local_id,global_id,batch,name,title,purpose,depends_on,path
B103-S04,,103,b103-run-environment-fingerprint,Run and Environment Fingerprint,"Fingerprint source state, runner, OS, toolchains, dependencies, services, test data and policies for reproducibility.",B103-S03,agent-skills/runtime/b103-run-environment-fingerprint/SKILL.md
B103-S05,,103,b103-artifact-provenance-signing,Artifact Provenance and Signing,"Generate signed provenance for patches, binaries, images, reports and route packs.",B103-S04,agent-skills/runtime/b103-artifact-provenance-signing/SKILL.md
B103-S06,,103,b103-tool-model-invocation-record,Tool and Model Invocation Record,"Record every consequential tool and model invocation with inputs, outputs, policy, cost and redaction.",B103-S05,agent-skills/runtime/b103-tool-model-invocation-record/SKILL.md
B103-S07,,103,b103-test-result-normalizer,Test Result Normalizer,"Normalize unit, integration, E2E, security, performance, device, infrastructure and manual results without erasing skips or flakes.",B103-S06,agent-skills/runtime/b103-test-result-normalizer/SKILL.md
B103-S08,,103,b103-approval-waiver-governance,Approval and Waiver Governance,Govern approvals and tightly bounded expiring waivers with separation of duties and non-waivable P0 rules.,B103-S07,agent-skills/runtime/b103-approval-waiver-governance/SKILL.md
B103-S09,,103,b103-evidence-expiry-invalidation,Evidence Expiry and Invalidation,Expire and invalidate evidence on time or causal change and propagate revocation to certifications.,B103-S08,agent-skills/runtime/b103-evidence-expiry-invalidation/SKILL.md
B103-S10,,103,b103-immutable-audit-ledger,Immutable Audit Ledger,"Record actor, decision, mutation, access and certification events in tamper-evident sequence.",B103-S09,agent-skills/runtime/b103-immutable-audit-ledger/SKILL.md
B103-S11,,103,b103-certification-policy-engine,Certification Policy Engine,Evaluate versioned certification rules deterministically against exact evidence scopes.,B103-S10;B98-S08,agent-skills/runtime/b103-certification-policy-engine/SKILL.md
B103-S12,,103,b103-scoped-certification-state,Scoped Certification State,"Represent certification by exact repository, commit, route, environment, journey, artifact and time scope.",B103-S11,agent-skills/runtime/b103-scoped-certification-state/SKILL.md
B103-S13,,103,b103-independent-verifier-workflow,Independent Verifier Workflow,Run evidence review and selected re-execution by an identity independent from implementation.,B103-S12,agent-skills/runtime/b103-independent-verifier-workflow/SKILL.md
B103-S14,,103,b103-evidence-export-portability,Evidence Export and Portability,"Export redacted, signed and independently verifiable evidence packs for customers, auditors and air-gapped review.",B103-S13,agent-skills/runtime/b103-evidence-export-portability/SKILL.md
B103-S15,,103,b103-assurance-cockpit-read-model,Assurance Cockpit Read Model,"Build evidence-backed read models for progress, coverage, risk, exceptions, freshness and certification state.",B103-S14,agent-skills/runtime/b103-assurance-cockpit-read-model/SKILL.md
B103-S16,,103,b103-anti-fake-certification-gate,Anti-Fake Certification Gate,"Reject fabricated, incomplete, stale, mock-only, self-approved or scope-inflated certifications.",B103-S15,agent-skills/runtime/b103-anti-fake-certification-gate/SKILL.md
B104-S01,,104,b104-certification-corpus-governance,Certification Corpus Governance,"Govern representative public, synthetic and customer-approved repositories with licensing, privacy and contamination controls.",B103-S16,agent-skills/runtime/b104-certification-corpus-governance/SKILL.md
B104-S02,,104,b104-representative-repository-selection,Representative Repository Selection,"Select repositories by language, framework, size, topology, dependency, quality and failure characteristics.",B104-S01,agent-skills/runtime/b104-representative-repository-selection/SKILL.md
B104-S03,,104,b104-certification-environment-matrix,Certification Environment Matrix,"Define and provision supported OS, architecture, runtime, database, container, cluster, CI and cloud matrices.",B104-S02,agent-skills/runtime/b104-certification-environment-matrix/SKILL.md
B104-S04,,104,b104-clean-room-end-to-end-benchmark,Clean Room End to End Benchmark,"Run repository-to-report, patch, build, test, PR, evidence and rollback from empty trusted environments.",B104-S03;B101-S16;B102-S16;B103-S16,agent-skills/runtime/b104-clean-room-end-to-end-benchmark/SKILL.md
B104-S05,,104,b104-portfolio-scale-benchmark,Portfolio Scale Benchmark,"Measure thousand-repository and million-line scheduling, storage, runner, graph, evidence and control-plane behavior.",B104-S04,agent-skills/runtime/b104-portfolio-scale-benchmark/SKILL.md
B104-S06,,104,b104-fault-injection-resilience-campaign,Fault Injection and Resilience Campaign,"Inject runner death, network loss, provider limits, registry failure, database locks, queue duplication and budget exhaustion.",B104-S05,agent-skills/runtime/b104-fault-injection-resilience-campaign/SKILL.md
B104-S07,,104,b104-security-red-team-campaign,Security Red Team Campaign,"Attack repository ingestion, prompts, sandboxes, secrets, supply chain, tenancy, APIs, CI and evidence gates.",B104-S06,agent-skills/runtime/b104-security-red-team-campaign/SKILL.md
B104-S08,,104,b104-upgrade-rollback-certification,Upgrade and Rollback Certification,"Certify ELMOS Core, Skill, schema, workflow, runner and route upgrades with rollback and in-flight compatibility.",B104-S07,agent-skills/runtime/b104-upgrade-rollback-certification/SKILL.md
B104-S09,,104,b104-disaster-recovery-replay-certification,Disaster Recovery and Replay Certification,"Prove backup, restore, regional recovery, workflow replay and external-effect reconciliation.",B104-S08,agent-skills/runtime/b104-disaster-recovery-replay-certification/SKILL.md
B104-S10,,104,b104-customer-pilot-onboarding,Customer Pilot Onboarding,"Onboard pilots with repository access, privacy, route fit, success criteria, support and exit plans.",B104-S09,agent-skills/runtime/b104-customer-pilot-onboarding/SKILL.md
B104-S11,,104,b104-customer-acceptance-protocol,Customer Acceptance Protocol,"Run customer-observed functional, behavioral, security, performance and operational acceptance.",B104-S10,agent-skills/runtime/b104-customer-acceptance-protocol/SKILL.md
B104-S12,,104,b104-operational-slo-readiness,Operational SLO and Readiness,"Define and validate availability, latency, durability, recovery, support and evidence freshness SLOs.",B104-S11,agent-skills/runtime/b104-operational-slo-readiness/SKILL.md
B104-S13,,104,b104-cost-unit-economics-certification,Cost and Unit Economics Certification,"Measure per-repository, per-LOC, per-runner-hour, per-model and support cost with margin scenarios.",B104-S12,agent-skills/runtime/b104-cost-unit-economics-certification/SKILL.md
B104-S14,,104,b104-support-incident-runbook-readiness,Support Incident and Runbook Readiness,"Validate support intake, triage, escalation, status communication, forensic preservation and corrective action.",B104-S13,agent-skills/runtime/b104-support-incident-runbook-readiness/SKILL.md
B104-S15,,104,b104-release-readiness-review,Release Readiness Review,"Aggregate engineering, security, legal, operations, support, cost and customer evidence into a decision packet.",B104-S14,agent-skills/runtime/b104-release-readiness-review/SKILL.md
B104-S16,,104,b104-product-certification-board-gate,Product Certification Board Gate,"Issue certified, limited, experimental or blocked status for an exact ELMOS release and support matrix.",B104-S15,agent-skills/runtime/b104-product-certification-board-gate/SKILL.md
